{
  "dataset_id": "m4-nosl-smoke-1000-final-dedup-manifest",
  "schema_version": 1,
  "game_version": "v0.111.0",
  "game_commit": "41cef1ea",
  "assembly_sha256": "0861BFA1DF347538D932F22D580E75420F08082792EB914E53B4882764ACDBE9",
  "cli_protocol_version": "0.2.0",
  "simulator_version": "cli-v0111-headless",
  "scorer_version": "not-applicable",
  "semantic_database_version": "game-runtime-v0111",
  "feature_schema_version": "1",
  "model_version": "none",
  "generator_config_hash": "1DEB4733836B2B4CB051E4810C467E1B72A4706BEDFE45FF7C675A9D7CCDC383",
  "feature_config_hash": "1DEB4733836B2B4CB051E4810C467E1B72A4706BEDFE45FF7C675A9D7CCDC383",
  "split_policy": "episode_or_seed_group",
  "row_count": 874,
  "state_count": 874,
  "action_count": 5294,
  "reliable_count": 362,
  "estimated_count": 480,
  "uncalculable_count": 32,
  "confidence_counts": {
    "Estimated": 480,
    "Reliable": 362,
    "Uncalculable": 32
  },
  "source_hashes": [
    "0322AF7587D947A6C9187FF67D1F30BD1F0D92C0E18615F0B7595EBAB506F676"
  ],
  "created_at_utc": "2026-08-31T03:01:14Z"
}
